<?xml version="1.0" encoding="UTF-8"?>
<!DOCTYPE ServiceEffectAutomaton SYSTEM "XmlSeffParser.dtd">
<ServiceEffectAutomaton>
        <statelist startstate="s1">
        <state>
                <name>s1</name>
                <time_consumption percentile="100" time="100"></time_consumption>
        </state>
        <!--state isFinalState="true"-->
        <state>
                <name>s2</name>
                <time_consumption percentile="100" time="100"></time_consumption>
        </state>
        <state>
                <name>s3</name>
                <time_consumption percentile="100" time="100"></time_consumption>
	</state>
        <state>
                <name>s4</name>
                <time_consumption percentile="100" time="100"></time_consumption>
	</state>
	<state>
                <name>s5</name>
                <time_consumption percentile="100" time="100"></time_consumption>
	</state>
	<state isFinalState="true">
                <name>s6</name>
                <time_consumption percentile="100" time="100"></time_consumption>
        </state>
        </statelist>
        <inputlist>
                <input>a</input><input>b</input><input>c</input><input>d</input>
		<input>e</input>
		<input>f</input>
		<input>g</input>
        </inputlist>
        <transitionlist>
                        <transition>
                                <sourcestate>s1</sourcestate>
                                <input>a</input>
                                <destinationstate>s2</destinationstate>
                                <probability>1</probability>
                                <time_consumption percentile="40" time="500"></time_consumption>
                                <time_consumption percentile="75" time="1000"></time_consumption>
                                <time_consumption percentile="100" time="2000"></time_consumption>
                        </transition>
        <transition>
                <sourcestate>s2</sourcestate>
                <input>b</input>
                <destinationstate>s2</destinationstate>
                <probability>0.72</probability>
                                <time_consumption percentile="50" time="1500"></time_consumption>
                                <time_consumption percentile="75" time="2000"></time_consumption>
                                <time_consumption percentile="100" time="4000"></time_consumption>
        </transition>
        <transition>
                <sourcestate>s3</sourcestate>
                <input>c</input>
                <destinationstate>s2</destinationstate>
                <probability>1</probability>
                                <time_consumption percentile="50" time="1500"></time_consumption>
                                <time_consumption percentile="75" time="2000"></time_consumption>
                                <time_consumption percentile="100" time="4000"></time_consumption>
        </transition>
        <transition>
                <sourcestate>s2</sourcestate>
                <input>d</input>
                <destinationstate>s3</destinationstate>
                <probability>0.08</probability>
                <time_consumption percentile="50" time="400"></time_consumption>
                <time_consumption percentile="75" time="1000"></time_consumption>
                <time_consumption percentile="100" time="2000"></time_consumption>
        </transition>
        <transition>
                <sourcestate>s2</sourcestate>
                <input>e</input>
                <destinationstate>s4</destinationstate>
                <probability>0.2</probability>
                <time_consumption percentile="70" time="500"></time_consumption>
                <time_consumption percentile="100" time="1500"></time_consumption>
        </transition>
        <transition>
                <sourcestate>s4</sourcestate>
                <input>f</input>
                <destinationstate>s5</destinationstate>
                <probability>1</probability>
                <time_consumption percentile="70" time="500"></time_consumption>
                <time_consumption percentile="100" time="1500"></time_consumption>
        </transition>
        <transition>
                <sourcestate>s5</sourcestate>
                <input>g</input>
                <destinationstate>s6</destinationstate>
                <probability>1</probability>
                <time_consumption percentile="70" time="500"></time_consumption>
                <time_consumption percentile="100" time="1500"></time_consumption>
        </transition>
        </transitionlist>
</ServiceEffectAutomaton> 